{
  "datapoints_config": [
    {
      "ends_before": "2017-06-02T00:00:00.000Z",
      "params": {
        "query": {
          "ds_id": 1
        }
      },
      "path": "/datavalues-ts2008"
    },
    {
      "begins_at": "2017-06-02T00:00:00.000Z",
      "params": {
        "query": {
          "ds_id": 2
        }
      },
      "path": "/datavalues-ts2008"
    }
  ],
  "derivation_description": "Lorem ipsum dolor sit amet, consectetur adipisicing elit, sed do eiusmod.",
  "derived_from_datastream_ids": [
    "592f155746a1b867a114e021"
  ],
  "description": "Lorem ipsum dolor sit amet, consectetur adipisicing elit, sed do eiusmod.",
  "enabled": true,
  "external_refs": [
    {
      "identifier": "3090",
      "type": "odm.datastreams.datastreamid"
    },
    {
      "identifier": "334",
      "type": "odm.stations.stationid",
      "url": "http://sensor.berkeley.edu/index_ucnrs.html"
    }
  ],
  "geo": {
    "coordinates": [
      -121.73638,
      37.381666,
      574.548
    ],
    "type": "Point"
  },
  "members": [
    {
      "organization_id": "592f155746a1b867a114e030",
      "roles": [
        "contact"
      ]
    },
    {
      "person_id": "592f155746a1b867a114e040",
      "roles": [
        "admin",
        "contact"
      ]
    }
  ],
  "name": "TS2008 Datastream",
  "organization_id": "592f155746a1b867a114e030",
  "preferred_uom_ids": [
    "met2008-centimeter"
  ],
  "source": "science.dendra.test.ts2008",
  "source_type": "sensor",
  "state": "ready",
  "station_id": "592f155746a1b867a114e060",
  "tags": [
    "ts2008_Class_TermA",
    "ts2008_Unit_Meter"
  ],
  "thing_id": "592f155746a1b867a114e070",
  "urls": [
    {
      "label": "Wiki",
      "url": "https://en.wikipedia.org/wiki/Conversion_of_units_of_temperature"
    }
  ]
}